{
  "schema": "wof-prospective-candidate-v1",
  "id": "T18_BODY7512_TM4_CURRENT_LEVEL_EXAMPLE",
  "promotion": "research-only",
  "identity": {
    "world": "Warriors of Fate (World 921031)",
    "sha256": "5c369ce2de4f53d8cef87eca5623a1f0d39a779e885532d6f185b81357878f62"
  },
  "rule": {
    "currentPredicates": [
      {"path": "body", "op": "eq", "value": 7512},
      {"path": "timer34", "op": "eq", "value": 4}
    ]
  },
  "outcome": {"expectedAttacks": [5440]},
  "windows": {"strictMaxMs": 100, "jitterMaxMs": 150, "lateMaxMs": 500, "hardMissMs": 1200},
  "gate": {"minProspectiveSignals": 1, "minProspectiveRooms": 1, "requireZeroHardMiss": true}
}
